[
  {
    "id": "lab-net-01",
    "category": "Networking",
    "title": "Public IP Reachable but Domain Name Fails to Resolve",
    "level": "Beginner",
    "estimatedTime": "10-15 min",
    "symptoms": "Workstation users report they cannot open corporate intranet web portals or external websites by name (e.g. intranet.corp.local, github.com), but pinging public IP 8.8.8.8 succeeds.",
    "environment": "Enterprise Branch Office LAN (192.168.10.0/24), Cisco Catalyst Switch, DHCP Server on Gateway, Active Directory Internal DNS.",
    "scenarioDescription": "A user calls the IT help desk stating: 'The Internet is completely down for my computer, but my coworker can still access everything.' As the network administrator, you need to isolate the fault domain methodically starting from local host configuration up through DNS query resolution.",
    "initialStepId": "step-net-01",
    "decisionPoints": [
      {
        "id": "step-net-01",
        "stepNumber": 1,
        "title": "Verify Local Workstation IP Configuration",
        "description": "Begin by inspecting the client's current IPv4 configuration to establish a baseline of the client's IP, subnet mask, default gateway, and DNS servers.",
        "evidenceType": "terminal",
        "evidence": "Lab Evidence - Workstation Windows Command Prompt:\nC:\\> ipconfig /all\n\nEthernet adapter Ethernet0:\n   Connection-specific DNS Suffix  . : corp.local\n   IPv4 Address. . . . . . . . . . . : 192.168.10.45(Preferred)\n   Subnet Mask . . . . . . . . . . . : 255.255.255.0\n   Default Gateway . . . . . . . . . : 192.168.10.1\n   DHCP Server . . . . . . . . . . . : 192.168.10.1\n   DNS Servers . . . . . . . . . . . : 192.168.10.250\n   NetBIOS over Tcpip. . . . . . . . : Enabled",
        "options": [
          {
            "id": "opt-net-1a",
            "text": "Immediately run 'ipconfig /release && ipconfig /renew' to re-request DHCP settings blindly.",
            "type": "suboptimal",
            "feedback": "Renewing DHCP without testing the existing gateway and DNS reachability destroys current state without telling you if the gateway or DNS server is reachable.",
            "nextStepId": "step-net-02"
          },
          {
            "id": "opt-net-1b",
            "text": "Ping the Default Gateway (192.168.10.1) and Public IP (8.8.8.8) to isolate Layer 1-3 network connectivity.",
            "type": "optimal",
            "feedback": "Optimal step: Testing the default gateway and a known public IP immediately separates local Layer 1/2/3 connectivity from application-layer DNS resolution issues.",
            "nextStepId": "step-net-02"
          },
          {
            "id": "opt-net-1c",
            "text": "Instruct the user to restart their computer to clear any transient network errors.",
            "type": "inefficient",
            "feedback": "Blind reboots waste time, disrupt users, and provide zero root cause evidence.",
            "nextStepId": "step-net-02"
          }
        ]
      },
      {
        "id": "step-net-02",
        "stepNumber": 2,
        "title": "Test Layer 3 Gateway and Internet Reachability",
        "description": "Execute ICMP echo probes to verify if the client can route traffic through the local default gateway and out to the Internet.",
        "evidenceType": "terminal",
        "evidence": "Lab Evidence - ICMP Ping Connectivity Test:\nC:\\> ping -n 2 192.168.10.1\nPinging 192.168.10.1 with 32 bytes of data:\nReply from 192.168.10.1: bytes=32 time<1ms TTL=64\nReply from 192.168.10.1: bytes=32 time<1ms TTL=64\nPing statistics for 192.168.10.1:\n    Packets: Sent = 2, Received = 2, Lost = 0 (0% loss)\n\nC:\\> ping -n 2 8.8.8.8\nPinging 8.8.8.8 with 32 bytes of data:\nReply from 8.8.8.8: bytes=32 time=14ms TTL=117\nReply from 8.8.8.8: bytes=32 time=13ms TTL=117\nPing statistics for 8.8.8.8:\n    Packets: Sent = 2, Received = 2, Lost = 0 (0% loss)",
        "options": [
          {
            "id": "opt-net-2a",
            "text": "Conclude that Internet routing is working properly, and test DNS resolution specifically using nslookup.",
            "type": "optimal",
            "feedback": "Optimal: Since both the default gateway and public IP 8.8.8.8 respond cleanly with low latency, Layer 1 through Layer 3 routing is healthy. The fault is isolated to DNS name resolution.",
            "nextStepId": "step-net-03"
          },
          {
            "id": "opt-net-2b",
            "text": "Replace the network patch cable connecting the workstation to the wall jack.",
            "type": "inefficient",
            "feedback": "The cable is transmitting packets cleanly at Layer 1/2 with 0% packet loss and <1ms latency to the gateway. Replacing hardware is unwarranted.",
            "nextStepId": "step-net-03"
          },
          {
            "id": "opt-net-2c",
            "text": "Disable the Windows Defender Firewall on the workstation.",
            "type": "unsafe",
            "feedback": "Disabling the local firewall weakens endpoint defense without addressing the fact that ICMP already succeeds bidirectionally.",
            "nextStepId": "step-net-03"
          }
        ]
      },
      {
        "id": "step-net-03",
        "stepNumber": 3,
        "title": "Probe DNS Name Resolution and Server Responsiveness",
        "description": "Use nslookup to query both internal and external hostnames against the configured DNS server (192.168.10.250).",
        "evidenceType": "terminal",
        "evidence": "Lab Evidence - DNS Query Diagnostics:\nC:\\> nslookup intranet.corp.local\nDNS request timed out.\n    timeout was 2 seconds.\n*** Can't find intranet.corp.local: No answer\n\nC:\\> nslookup intranet.corp.local 192.168.10.250\nDNS request timed out.\n    timeout was 2 seconds.\n*** Can't find intranet.corp.local: No response from server\n\nC:\\> ping -n 2 192.168.10.250\nPinging 192.168.10.250 with 32 bytes of data:\nReply from 192.168.10.45: Destination host unreachable.\nReply from 192.168.10.45: Destination host unreachable.",
        "options": [
          {
            "id": "opt-net-3a",
            "text": "Test DNS resolution against the known corporate Domain Controller at 192.168.10.10 and public DNS 8.8.8.8.",
            "type": "optimal",
            "feedback": "Optimal: By testing with an explicit DNS server IP (nslookup intranet.corp.local 192.168.10.10), you can confirm whether the real DNS server is operational and why 192.168.10.250 is unreachable.",
            "nextStepId": "step-net-04"
          },
          {
            "id": "opt-net-3b",
            "text": "Add intranet.corp.local and all external websites manually into C:\\Windows\\System32\\drivers\\etc\\hosts.",
            "type": "inefficient",
            "feedback": "Editing the hosts file is an unmaintainable workaround that does not solve the root network problem and breaks dynamic DNS updates.",
            "nextStepId": "step-net-04"
          },
          {
            "id": "opt-net-3c",
            "text": "Delete the client's local DNS cache using 'ipconfig /flushdns' and retest.",
            "type": "suboptimal",
            "feedback": "Flushing local cache won't help when the configured DNS server IP (192.168.10.250) itself is completely unreachable.",
            "nextStepId": "step-net-04"
          }
        ]
      },
      {
        "id": "step-net-04",
        "stepNumber": 4,
        "title": "Cross-Verify DNS Server Availability and Scope Configuration",
        "description": "Test queries against the primary corporate DNS server at 10.10.10.10 and inspect the local branch router's DHCP scope settings.",
        "evidenceType": "terminal",
        "evidence": "Lab Evidence - Explicit DNS Query & Router DHCP Scope:\nC:\\> nslookup intranet.corp.local 192.168.10.10\nServer:  dc01.corp.local\nAddress:  192.168.10.10\n\nName:    intranet.corp.local\nAddress:  192.168.10.80\n\nRouter SSH Session (Router# show run | section dhcp):\nip dhcp pool BRANCH-OFFICE\n   network 192.168.10.0 255.255.255.0\n   default-router 192.168.10.1\n   dns-server 192.168.10.250 192.168.10.10\n   lease 0 8",
        "options": [
          {
            "id": "opt-net-4a",
            "text": "Identify that 192.168.10.250 is an invalid/decommissioned DNS server configured as primary in the DHCP pool, and proceed to final remediation.",
            "type": "optimal",
            "feedback": "Optimal deduction: The router's DHCP pool is handing out 192.168.10.250 as primary DNS. Because 192.168.10.250 is dead, queries time out before failing over or aborting. Updating the DHCP pool to 192.168.10.10 permanently resolves the issue.",
            "nextStepId": "diagnosis"
          },
          {
            "id": "opt-net-4b",
            "text": "Reboot the router to force all clients to renegotiate DHCP.",
            "type": "unsafe",
            "feedback": "Rebooting the router will disrupt all active sessions across the branch office without fixing the misconfigured DNS IP in the running config.",
            "nextStepId": "diagnosis"
          }
        ]
      }
    ],
    "finalDiagnosis": {
      "title": "DHCP Scope Misconfigured with Decommissioned Primary DNS Server",
      "rootCause": "The branch office DHCP scope on the default gateway (192.168.10.1) was distributing 192.168.10.250 as the primary DNS server. This server was decommissioned last week, resulting in 2-second query timeouts on all client DNS requests. The secondary DNS server (192.168.10.10) was fully functional but client lookups were failing or experiencing extreme latency.",